赣北江南行（4）—景德镇古窑民俗博览区,http://www.mafengwo.cn/i/18841378.html,"去看看>,不再显示,出发时间/2020-03-12,出行天数/1天,人物/一个人,本篇游记共含0个文字，5张图片。帮助了名游客。,举报","['http://n1-q.mafengwo.net/s15/M00/78/BD/CoUBGV5q3xSAFT_aAAujP9cYmNU347.jpg', 'http://p1-q.mafengwo.net/s15/M00/78/E0/CoUBGV5q3zqAMTxlABNGm9gxrSY136.jpg', 'http://b1-q.mafengwo.net/s15/M00/78/F4/CoUBGV5q30qAbLN5AAfQ0hiGtX0043.jpg', 'http://n1-q.mafengwo.net/s15/M00/79/26/CoUBGV5q322AZ0KIABIVEzwXjPE008.jpg', 'http://n1-q.mafengwo.net/s15/M00/79/57/CoUBGV5q35qAfa0xAA3VyJYFMgU846.jpg']"
敢问路在何方，第二集（景德镇之旅）,http://www.mafengwo.cn/i/18811285.html,"去看看>,不再显示,出发时间/2019-10-01,出行天数/3天,人物/和朋友,人均费用/600RMB,摩肩接踵，万人空巷，一直以来，小长假都是十分火爆的旅游旺季。即便如此，浩阳和蛋蛋也不想错过这个绝好的机会。对于他们而言，三天以上的假期就是弥足珍贵的。一票难求、物价高涨、人山人海，这都是可以克服的困难。,事实上，这次,景德镇,之旅很悬。浩阳和蛋蛋是在假期开始的半个月前才决定好旅行的地方和天数。这时的酒店，尤其是性价比高的酒店/民宿早已全部售罄。好不容易确定了酒店和返程车票，而前往,景德镇,的车票却迟迟抢不到，过不去，后面的行程就全泡汤了。终于，在出发的前两天抢到两张前往,景德镇,的火车票。清晨，硬座，62.5元/张，大约6小时车程，但这对于二位来说，是个好消息。在这里，提醒下小长假出行的伙伴们，请务必提前做准备，越早越好。,DAY1抵达景德镇,景德镇,，别名瓷都，因瓷器扬名于中外。此刻的浩阳和蛋蛋正在火车上看国庆阅兵直播，悠闲地前往这个充满文艺气息的历史小镇。,当地时间下午14：58，风和日丽，阳光高照，抵达,景德镇,后，我们决定乘公交前往第一站，陶溪川。公交车缓缓的向小镇驶去，窗外景色怡人。,十几分钟后，我们抵达陶川溪的一个入口，这里就像我家乡的小镇，去哪儿距离都不远，很省心。,在陶川溪里，小帐篷一个接一个码的整整齐齐，以陶瓷为主的手工艺品满目琳琅，如果你喜欢这些充满创意的小手工，那这里一定是你的天堂。浩阳和蛋蛋当然也不想错过，走了好久好久，都没有到尽头，而道路两旁还坐落着一家家精致的店铺....陶瓷在蛋蛋同学心中是另一种国粹，博大精深，敬仰之。,路边小帐篷的陶瓷手工艺品,偶遇国庆快闪趴—歌唱我和我的祖国,道路旁的店铺,转眼间就到了晚餐时间，我们决定先步行回民宿，确定住宿位置，再外出觅食。很庆幸，计划的最后我们在爱彼迎上找到了一家离陶川溪步行距离15分钟的民宿。虽然实际步行距离花了20多分钟，过程如迷宫寻宝，但是在这种旺季，能找到近中心地段，价格合适的栖息地，实属幸运。国庆房价168/每晚，平时120/每晚。小区有24小时门卫值班，独立卫生间，电视，甚至一个大落地窗，要知道国庆期间，几乎没有低于400元/晚的酒店（民宿除外），价钱值得。但如果你是一个女孩独自出游，蛋蛋还是建议你优先选择大一点的酒店单间，毕竟安全第一。,在寻找民宿的路上,在民宿休息片刻后，我们决定前往大数据上呼声最高的饭馆恰晚餐。路上车程10分钟，淋漓尽致的彰显出小镇的距离优势。没有预约取号功能，我们抵达饭店时，店门口已经坐满了排队的人，乌泱泱一片，让狭小的街道显得更加拥挤。好在不饿，浩阳和蛋蛋排了号，一拍即合的决定溜达到吃饭前回。,转角处的夜景,偶遇的特色美食—好吃的甜糍粑球球,店名就叫——回家吃饭,特色复古奶茶+豆泡鱼头=好评,吃饱喝足压马路，我们决定再次返回陶溪川，毕竟栖息地也在附近。果然，夜游也别有一番风味。,陶溪川的夜景很漂亮，集市上的人明显比白天多，这里真的很大，夜游的我们找到无数新的店铺和两座展览馆，我们陶醉在这个充满文艺气息的小镇上，自在的游荡着。,步行回家，完美的消化掉晚餐。明天将开启新的旅程。,DAY2出发新旅程,“一日之计在于晨早餐”，浩阳和蛋蛋醒来的第一件事就是奔往大数据推荐的头牌牛骨粉店。老板的第一句话是能吃辣不。事实证明，,江西,的辣子真的辣，但就是巨好吃。甚是怀念,江西,的辣。除了够味的牛骨粉，油条麻糍也超好吃。满足的早餐。,吃完早餐，顺势沿着巷子走，条条大路通,罗马,。我们又偶遇了七小粑店，在游人的怂恿下，果断入手。旅行中的人，一定是最舍得的，品尝未曾相识的美食也是一大乐趣。,走出巷子，我们看到御窑厂国家考古遗址公园，由于浩阳同学坚信我们所见到的门不是大门，于是在浩阳导游的带领下我们,成功,的绕到了紧紧锁上的后门，也就无缘于此公园了。接下来，将有蛋蛋同学带队到5A级旅游景点,景德镇,古窑民俗博览区。,从取票大厅里的仿陶瓷吸顶灯，进门口的巨大陶瓷瓶，到路边的墙壁上的陶瓷碎片和各种形状的陶瓷品，甚至还有陶瓷排水渠以及阳光底下闪闪发光的陶瓷地砖。无一不陶瓷，甚是有趣。,你可以在这里了解到更多关于陶瓷的知识，,比如,陶瓷一步步制作成型的流程，,比如,关于陶瓷的历史故事，甚至在这个博览区里面还有一片很大的池塘，可以供游人欣赏自然风光。浩阳一行比较遗憾的是没能听到瓷音水榭，暂时无缘与这个世,界首,创的瓷乐团。,参观完博览区，浩阳和蛋蛋决定去捏泥巴，这对从未尝试过陶艺的她们是一个绝好的机会。阳光灿烂，水土怡陶。根据眼缘我们选择了一家在大数据上评价不错，人数较少的店。记得提前电话咨询等位人数哦，不让等待也会花费不少时间。,本篇游记共含3366个文字，56张图片。帮助了名游客。,举报","['http://p1-q.mafengwo.net/s15/M00/8A/13/CoUBGV5eJfWAFr4cAAwfQjhSg0Q041.jpg', 'http://n1-q.mafengwo.net/s15/M00/E5/BA/CoUBGV5eQiKARE_mABcPSNaazao631.jpg', 'http://p1-q.mafengwo.net/s15/M00/33/FB/CoUBGV5kYg-AEnu8AAje8F0Svu4175.jpg', 'http://n1-q.mafengwo.net/s15/M00/34/0B/CoUBGV5kYhyAEDssAA65yhxFuDI059.jpg', 'http://b1-q.mafengwo.net/s15/M00/34/1D/CoUBGV5kYi6ASvLOAAsrLFDcAXU866.jpg', 'http://p1-q.mafengwo.net/s15/M00/3E/81/CoUBGV5kaVaAfrv3AAxNBeEJyZI774.jpg', 'http://b1-q.mafengwo.net/s15/M00/3E/8C/CoUBGV5kaV6ATDwqAA5PQLC_mvk222.jpg', 'http://b1-q.mafengwo.net/s15/M00/3E/9F/CoUBGV5kaWuAXNVyACUhV18tj78644.jpg', 'http://b1-q.mafengwo.net/s15/M00/4A/0E/CoUBGV5kccGAfT8_AAEpDp6-u5U401.jpg', 'http://b1-q.mafengwo.net/s15/M00/7E/5A/CoUBGV5kmrGAFjLRABIJB9QVJBE149.jpg', 'http://p1-q.mafengwo.net/s15/M00/7F/9D/CoUBGV5km9KAV4UxAAcr9YYksRU938.jpg', 'http://p1-q.mafengwo.net/s15/M00/81/C2/CoUBGV5knbKASaPHAAJ0AC4AirU826.jpg', 'http://n1-q.mafengwo.net/s15/M00/82/F5/CoUBGV5knt2AXdjvAAbQQ5tlP34888.jpg', 'http://p1-q.mafengwo.net/s15/M00/87/0F/CoUBGV5kon2AA2BSAAkzrRZwmdc801.jpg', 'http://n1-q.mafengwo.net/s15/M00/87/1B/CoUBGV5kooeAcqEbAAts5Miv9xI095.jpg', 'http://b1-q.mafengwo.net/s15/M00/8F/5A/CoUBGV5kp56AEBDOAApwrI2MkJw236.jpg', 'http://b1-q.mafengwo.net/s15/M00/8F/5C/CoUBGV5kp5-ALFBhAAYriZKgzEo728.jpg', 'http://b1-q.mafengwo.net/s15/M00/8F/5E/CoUBGV5kp6CAJccCAAqlluaMA5U171.jpg', 'http://b1-q.mafengwo.net/s15/M00/98/23/CoUBGV5kreiAaaepABCz3an2XsM431.jpg', 'http://n1-q.mafengwo.net/s15/M00/9A/32/CoUBGV5kr-mAfjeXACDyjRWP7bU361.jpg', 'http://n1-q.mafengwo.net/s15/M00/A6/44/CoUBGV5kuUKAPdUfAAzqOkSW2Wk175.jpg', 'http://p1-q.mafengwo.net/s15/M00/A9/E2/CoUBGV5kvCiAFBdkAA8EXYBYi0o817.jpg', 'http://n1-q.mafengwo.net/s15/M00/A9/EC/CoUBGV5kvDSAUfvEAA_pRfIR5b4846.jpg', 'http://b1-q.mafengwo.net/s15/M00/AA/0A/CoUBGV5kvEmANBT9AA2QTLDnpOc176.jpg', 'http://n1-q.mafengwo.net/s15/M00/AD/AE/CoUBGV5kv1iAcgluABLeyy_avYY204.jpg', 'http://p1-q.mafengwo.net/s15/M00/AA/36/CoUBGV5kvG6AIM2rAAX1KKKOKsc047.jpg', 'http://b1-q.mafengwo.net/s15/M00/AE/FE/CoUBGV5kwFWAHih_AAqjuXHh2OY255.jpg', 'http://p1-q.mafengwo.net/s15/M00/B0/65/CoUBGV5kwWiAIZNYAA7NRVJmLx4041.jpg', 'http://b1-q.mafengwo.net/s15/M00/B0/6F/CoUBGV5kwXKAB3ElAAZl5fcLhOo933.jpg']"
China town,http://www.mafengwo.cn/i/18738670.html,"去看看>,不再显示,出发时间/2018-04-03,出行天数/3天,人物/和朋友,shi由于前几天比较懒，直到今天刚缓过来，赶紧给大家分享下,景德镇,（Chinatown）攻略,清明小长假和老姐还有姐姐的朋友一同去了,景德镇,，简单和大家说一下我们的行程,DAY1:,其实也不能算作一天，主要是想延长下假期，小长假前一晚就出发了。从,杭州,到,景德镇,有直达的高铁和火车，因为工作不方便请假，我们选择了去,上饶,转了下车，在,上饶,不需要出站，整体换乘也是方便的，中间有空闲，买了,大名,鼎鼎的,上饶,鸡腿（下了火车就能看到，太晚车站外基本没有什么吃的，所以要果断下手哦，10块一个，趁热吃味道还不错）。我们4号下午从,杭州,东出发,坐火车到,景德镇,北站（如果时间不紧张，建议大家白天出发，下午或傍晚到,景德镇,，因为,景德镇,北站那里比较偏，夜间十点后出租车会加钱，白天的起步价是7块，晚上会增加到8块，另外夜间打车也会在多收5-10块，而且滴滴打车也很少），建议假期期间大家不要驾车去,景德镇,（你懂的）。我们晚上11点30到的北站，两天打车下来让我有一种感觉，,景德镇,司机就是,景德镇,一景（此处省略无数字）。酒店提前在网上定好，价格也很亲民，我们定的是瓷源山庄酒店，离市区有点偏，但是环境不错，性价比也很高（如果夜里要出来逛夜市吃夜宵的不建议定这里，因为这里晚上11点后能觅食的地方只有外卖）。,DAY2：,第一站：古窑民俗博览区虽然酒店的地方比较偏，但是滴滴一下还是很方便的。，我们打车到我们提前订的酒店(瓷源酒店),在这里我就要吐槽一下某龙软件了，订单在酒店那里显示不出来耽误了好久，我们定的那个酒店总体上还是很棒的，就一个缺点有点偏，附近什么都没有，吃东西只能外卖，第二天早上我们定的是去古窑，早上起来去酒店吃个早饭，打个滴滴就去古窑了，酒店与古窑还是蛮近的，打车大概15min,,景德镇,市内打车基本20块就可以到一个新的景点。“清明时节雨纷纷”，一到古窑就开始下雨（但是下雨天与欣赏陶瓷绝配，毕竟这样人也会少很多）。,关于门票：建议大家到官网去买，会比直接窗口买便宜50左右，不建议买旅行软件上非官方渠道出售的票，否则可能会来不及验证，不要问我怎么知道的……。古窑是全国唯一一家以陶瓷文化为主题的国家级旅游景区。古窑民俗博览区主要景点有历代古窑展示区，陶瓷民俗展示区，水岸前街创意休憩区三大景区。我们是去当傻子的（只会欣赏陶瓷），在古窑里一直逛，建议大家不要在古窑里买东西很贵，但是可以看到很多窑的原址，还有一些老艺术家的工艺，还是能够看得出,景德镇,“瓷都”的名头不是名副其实的。,第二站：陶溪川简单在街边吃了点午饭，,江西,人爱吃辣还真不是夸张，就像某个司机师傅说的“恨不得炒白菜也要放一把辣椒”。我们下午我们去了陶溪川，本着做陶瓷为目的去的陶溪川，到了那里就看到了两家陶吧，一家人很多，一家开窑要等几个月，我们就没体验，在陶溪川那还是比较有味道的，属于大学生创业的园区，既充满着,景德镇,陶瓷的属性，也能够看到很多文创产品，园区安静的道上没有车，老式的厂房经过改造也很有味道，比较适合文艺青年，也很适合拍照。边逛了一会儿吃了个饭就走了，在这里那边买了几件陶瓷，整体的价格那边的陶瓷的价格还可以，原创的产品很多，也是可以淘到一点喜欢的东西的。,第三站：毛仔特色小吃逛完陶溪川基本也到了晚饭的点，因为雨把鞋子全都湿透了，我们决定吃完晚饭就回酒店。打车10块到但是要买便宜的陶瓷还要去雕塑市场，晚上去了毛仔特色小吃，点了很多特色小吃（冷粉、油炸清汤、鲶鱼豆冲等等），毛仔附近就是麻辣婆,景德镇,的一个特色小吃，由于吃的太饱了就没吃（遗憾），路过可以看到这家店。,DAY3：,这一天我们的目的地是买了点水果就回宾馆了，第二天我们打车去了,瑶里,古镇，建议大家还是包车去,瑶里,，因为,瑶里,景点分的很散，如果要是打车去几乎一天也就能玩两个景点。在网上可以买到,瑶里,古镇的套票，但是经过我们此次试验，除了其中的原始森林和,瑶里,博物馆需要门票，其他的你可以放心大胆的玩耍。我们包车整体一天（包括往返,景德镇,，大概花费400多），这个价格还可以，因为可以几乎可以逛遍,瑶里,的景点，同时也比较省事。，,瑶里,的景色还不错，比较适合4.5月份出行，也可以喝上,瑶里,的明前茶，高山茶的味道相对低山的的确会好很多。清明人很少，很适合那个时间去玩，如果5、6月份去还可以漂流，汪胡那条街有颗千年红豆杉，,徽杭古道,，高岭国家矿山公园，瀑布，东埠古码头，,梅岭,，在,瑶里,会发现，千年的古树是很正常的，600、800年的真不算高龄了，花了10块买了几片,樟树,根的切片，貌似觉得这是可以回家放在柜子里防虫吧，味道很重，所以放在包里最好包严。风景很不错，8点半从,景德镇,出发，在那边玩了一天，返回到,景德镇,差不多晚上6点多，返杭的票是8点的，我们就先去了回到,景德镇,去了雕塑市场，这个地方陶瓷是真的便宜，10块2个花瓶，20块就可以买个卖相不错的杯子，要想买陶瓷的朋友可以去那，但是基本7点多就都关门了。晚上在附近那边吃了顿饭打车到就去,景德镇,北站了，BACK！总体下来还是玩的不错的，也多少了解了些陶瓷方面的文化。知道陶瓷工艺，了解了些,景德镇,文化，收获颇,丰镇,子虽小，文化颇深，乐趣都在行走中。,本篇游记共含2100个文字，11张图片。帮助了名游客。,举报","['http://p1-q.mafengwo.net/s15/M00/F6/40/CoUBGV5V9x-Af2UiAAigM8ELd9k681.jpg', 'http://n1-q.mafengwo.net/s15/M00/F6/45/CoUBGV5V9yGAVOj5AAL18P4L2tg646.jpg', 'http://p1-q.mafengwo.net/s15/M00/F6/4A/CoUBGV5V9yKAUoOLAAKMwRvyNk4840.jpg', 'http://b1-q.mafengwo.net/s15/M00/F6/51/CoUBGV5V9yOAAGRDAAm7A-2UHpc723.jpg', 'http://p1-q.mafengwo.net/s15/M00/F6/59/CoUBGV5V9yWASdxAAA7iITqVQB4826.jpg', 'http://n1-q.mafengwo.net/s15/M00/F6/5F/CoUBGV5V9yeAPrx4AAmcw4le9eY759.jpg', 'http://n1-q.mafengwo.net/s15/M00/F6/64/CoUBGV5V9ymASuZfABCjiH5gDSw773.jpg', 'http://b1-q.mafengwo.net/s15/M00/F6/68/CoUBGV5V9yqAEIU0AA5S7y2e5Ok248.jpg', 'http://p1-q.mafengwo.net/s15/M00/F6/6D/CoUBGV5V9yuAZgjDAAuuUcA5a_o307.jpg', 'http://n1-q.mafengwo.net/s15/M00/F6/71/CoUBGV5V9yyAEoUVAAXr67XkIcc077.jpg', 'http://b1-q.mafengwo.net/s15/M00/F6/76/CoUBGV5V9y6ALti5AA0bdmwQGDE630.jpg']"
