【景德镇】蚊垤蜂窠巷曲斜，坯工日夜画青花-清幽自驾游圣地,http://www.mafengwo.cn/i/15779301.html,"去看看>,不再显示,出发时间/2019-07-12,出行天数/3天,人物/一个人,人均费用/2500RMB,中国,自古便被誉为“瓷器之国”，而,景德镇,则是其代表和象征。历史上的,景德镇,陶瓷名扬海外，其器“白如玉，薄如纸，明如镜，声如磬”。典雅秀丽的青花，五彩缤纷的彩绘，斑驳绚丽的色釉，玲珑剔透的薄胎，巧夺天工的雕塑……绚丽多姿的名贵瓷器，通过海上路上,丝绸之路,，“行于九域，施及外洋”。,【交通】,自驾游：,南昌,出发自驾游三日，全程高速行驶大概2小时30分钟到达目的地，高速单程费用￥70.00,【住宿】,花筑·,景德镇,视界陶也民宿,地址：,江西,省,景德镇,市陶阳南路20号,视界一步知窑,酒店整体装修具有瓷都特色，所有房间均按照乡村民宿风格布置，露台会放置一些可供住客使用的茶具和茶叶，晚间会按照人数赠送爽口甜汤，价格含早大约￥300.00,【行程】,第一日,早上09：00开车出发，中午11：30抵达,景德镇,，12：00在花筑·,景德镇,视界陶也民宿办理完成入住后直接去吃,景德镇,比较出名的牛骨粉。口碑较好的有两家分别是樊氏牛骨粉和吴氏牛骨粉，吴氏牛骨入味辣椒很带劲儿回味无穷，樊氏牛骨口感比较筋道有嚼劲；入住宾馆对面就有樊氏牛骨粉分店，成年男子一份牛骨粉刚好，先直接上手啃牛骨这样比较有感觉，价格￥18.00；饭后午休一个小时可以驱车直接前往,景德镇,中国,陶瓷博物馆。,(位置),中国,陶瓷博物馆,地址：,江西,省,景德镇,市,昌江,区紫晶北路1号,开放时间：09：00-17：00,门票价格：免费,预计时间：简单浏览约90分钟，请讲解员约150分钟,景德镇中国陶瓷博物馆,👉历史－了解陶瓷的前世今生,馆内收藏了新石器时代的陶器和汉唐以来各个不同历史时期的陶瓷珍品重器3万余件（其,中国,家珍贵文物500余件），涵括了,景德镇,千年制瓷历史长河中的代表品种，展品美轮美奂确实很震撼，个人最喜欢康熙年间的作品，画工非常工整细腻，超赞!,游览完,中国,陶瓷博物馆后可以直接返回民宿，民宿隔壁开设有一步之窑餐厅，与民宿同一老板，口味不错，人均消费￥50.00；饭后步行前往第一日最后地标陶艺街。,(位置)陶艺街,地址：,江西,省,景德镇,市珠山区陶艺街,开放时间：全天,门票价格：免费,预计时间：约45分钟,台资味,👉创作－每个瓷艺家的灵感视界,陶艺街长长干净的街道两旁都是漂亮的小洋房，延长着许许多多陶瓷品牌，街上的所有店铺都是单独存在，并且每个都非常推荐，因为美丽设计独到，大部分都有老板宽敞的茶室和自己的工作室。每一家店有每一家店的特色，艺术气息浓厚，非常适合闲逛品瓷喝茶。,第二日,早上起床09：00前都可以使用酒店自带的早餐，品种相对来说比较中规中矩，也可以出门左转去寻找一家叫做光头冷粉的店家，他们家在,景德镇,冷粉应该是做的最好的，就是每日限量一定量的冷粉，真的是佛系做生意。早餐后可以直接开车去古窑民俗博览区开启第二天的旅程。,(位置),景德镇,古窑民俗博览区,地址：,江西,省,景德镇,市瓷都大道古窑1号,开放时间：08：00-17：00,门票价格：成人¥95.00，网络票￥85.00，学生¥45.00,预计时间：整天,景德镇古窑民俗博览区,👉值得－与非物质文化遗产手工艺大师零距离接触,景区布局,景区分为历代古窑展示区、陶瓷民俗展示区、水岸前街创意休憩区三大区域。历代古窑展示区内有古代制瓷作坊、世界上最古老制瓷生产作业线、清代镇窑、明代葫芦窑、元代馒头窑、宋代龙窑、风火仙师庙、瓷行等景点，明清时期,景德镇,手工制瓷的工艺过程以及传统名瓷精品。陶瓷民俗展示区有十二栋明、清时期古建筑，有陶瓷民俗陈列、天后宫、瓷碑长廊、水上舞台瓷乐演奏等景观。水岸前街创意休憩区内有昌南问瓷、昌南码头、耕且陶焉、前街今生、木瓷前缘等瓷文化创意休闲景观。部分区域可以亲眼目睹瓷器制作过程，很多手工艺人（大师级）现场制作、雕刻、绘画。有兴趣也可以自己动手制作瓷器带走¥100+，会有专人教你，如果有钱买收藏品最好这里买，大部分都是园区里面师傅手工制作后在真实古窑烧制出来的，当然价格也不便宜。,古窑过后需要一定的放松，前往陶溪创是不错的选择，顺便可以文艺一点解决自己的晚饭。,(位置),景德镇,陶溪川创意广场,地址：,江西,省,景德镇,市珠山区新厂西路150号,开放时间：全天,门票价格：免费,预计时间：2小时,景德镇陶溪川创意广场,👉文艺－年轻一代陶瓷品集合地,地处一轴五片十一厂的布局横跨,景德镇,两个中心城区，毗邻三院两校，占地面积大概千亩左右，涵盖各类艺术工作室、餐饮、商务酒店会所、休闲剧场、博物馆、特色精品街、主题客栈、百货商场等，其中广场周边为轻餐饮，后厅锯齿厂房改造为学院派艺术工作室，前后厅空间互为交流，外部在保留老厂房原有风格的基础上加入现代设计元素，强烈的对比带有鲜明的时代感，整体和谐统一；整个园区的配套服务设施与文化建设将会逐步完善，最终建成以陶瓷文化为核心的与世界接轨的文化艺术创意交流平台。,东西价格比较贵咱也不懂瓷器品质咱也不敢妄加评价，去了就是一个状态：咱也不知道，咱也不敢说，咱也不敢问！真的很贵！而且不能讲价！不过很适合拍照类似,北京,798艺术区-,南昌,699文化创意园,第二天行程比较累，晚上可以犒劳一下自己整一顿烧烤再回酒店，这里就要推荐为宇路老倌烧烤，味道一绝特别是小肉金针菇鸡爪，点单到上“菜”等了一小时等到自闭，但是真的不后悔巨好吃，良心说,东北,人南方这么久，基本是五年内吃过最好吃的烧烤。,第三日,第三天就是返程，不能太累，所以安排两个闲逛的地标，首先就是,景德镇,雕塑瓷厂,(位置),景德镇,雕塑瓷厂,地址：,江西,省,景德镇,市珠山区新厂西路139号,开放时间：全天,门票价格：免费,预计时间：2小时,景德镇雕塑瓷厂,👉物件－大学生瓷器作品乐天集市,这里以前是一个陶瓷工厂，里面有很多老陶瓷物件，后面慢慢许多喜爱陶瓷的人汇聚，现在很多大学生手作创意瓷器在这里贩卖，很多都是孤品慢慢淘总有你喜欢的店铺比较多也很多促销。,上午结束可以直接开车去最近的小饭店吃饭，最为推荐的,镇巴,佬家庭餐馆，剁椒鱼头好吃，好这口的不要错过，刚好午饭人多差不多等了40分钟左右才上菜，因为是蝇头小馆就餐环境不怎样但是鱼是真的好吃，午饭后可以直接去,景德镇,国际商贸广场采购送亲友的纪念品。,(位置),景德镇,国际商贸广场,地址：,江西,省,景德镇,市珠山区解放路152号,开放时间：全天,门票价格：免费,预计时间：2小时,景德镇国际商贸广场,👉购物－,景德镇,这儿其实是个购物市场，主要售卖日用器具，如果要买伴手礼值得去，物美价廉尽情砍价，货品跟雕塑瓷厂的差不多，但是价格低很多（基本上打骨折），淘宝五六百这里一百多，什么样子多大的基本应有尽有。,到这里基本可以结束了，返程记得不要太早，高速晚上卡车还是比较多的，总体来说,景德镇,是一个清新可以让人放松学习历史文化的小城市！,本篇游记共含2659个文字，7张图片。帮助了名游客。,举报","['http://p1-q.mafengwo.net/s14/M00/D1/87/wKgE2l0z26SAV0CQAAHf7fQBda4715.jpg', 'http://b1-q.mafengwo.net/s14/M00/0C/5E/wKgE2l0z9biAOGRBAAfd-6GhBLw404.jpg', 'http://n1-q.mafengwo.net/s14/M00/15/39/wKgE2l0z-fqAMEFjAAHZ2W4Lehw326.jpg', 'http://b1-q.mafengwo.net/s14/M00/3E/39/wKgE2l00DIiAWgpMAANQrPAB-xs306.jpg', 'http://b1-q.mafengwo.net/s14/M00/2D/E3/wKgE2l00BUaAJP10AAGKPtPEb4k580.jpg', 'http://b1-q.mafengwo.net/s14/M00/39/04/wKgE2l00CjeAFamRAAVWuckUplA604.jpg', 'http://p1-q.mafengwo.net/s14/M00/3D/77/wKgE2l00DDuAToO2AAjmOXq6xg4454.jpg']"
景德镇自由行攻略,http://www.mafengwo.cn/i/15771702.html,"去看看>,不再显示,2019期间，做了很多的准备工作，想着去热门景点人太多，于是我找到了,景德镇,瑶里,景区，关键是属于旅游年卡的免费景点，好吧，那就走起吧。,（套用携程的景点详情做个简介。）,瑶里,，古名“窑里”，因是,景德镇,陶瓷发祥地而得名，这片古老而又神奇的地方，既有深厚的文化积淀，又是人们享受大自然的绿色仙境。她集山岳、林海、瀑布、峡谷等自然风光和古镇、古窑址等人文景观为一体，山水、人文俱美，原始、古朴、清静，一年四季气候适宜，是享受大自然洗礼的绿色家园，是访古探幽、感悟天人合一的佳境。,瑶里,主要开发景区有千年古城、绕南古窑文明遗址、汪胡冰臼大峡谷（原始森林、冰臼奇观、南山大瀑布）、高岭土世界矿山公园（东埠古村落、石群、千年古,樟树,）、瑶河漂流、等五大景区。,我们是6月2日上午从,南昌,出发的，到,景德镇,大概下午2点，逛了,景德镇,位于雕塑瓷厂的明清园，这里是,景德镇,著名的瓷器创意集市。这是当地政府为了鼓励大学生自主创业，而创办的“大学生创意集市“。有很多陶瓷院的在校大学生将自己的手工作品拿来在这里展示、售卖，寻求合作和创业的机会。,早晚在古镇发呆闲逛，美丽的瑶河贯穿东西，沿河错落有致地分布着数百幢明清古建筑和革命旧址等众多人文景观，飞檐翘角，粉墙黛瓦，掩映在青山绿水之中。古镇的街巷基本上用青石板铺成。古镇不需要门票。适合休闲慢游。女儿捞鱼，老公拍照、捡石头，我听小桥流水，感受清风拂面，上午去了汪胡冰臼大峡谷、绕南古窑文明遗址，女儿最开心的是第一次体验拉胚。古镇的餐饮有点小贵，毕竟在景区里面。有地皮姑，小河鱼，鸭脚板（野菜）还有早上必吃的咸水粑。,本篇游记共含667个文字，13张图片。帮助了名游客。,举报","['http://b1-q.mafengwo.net/s14/M00/A0/7E/wKgE2l0zx2OAZiC3AALD2uDptsw763.jpg', 'http://b1-q.mafengwo.net/s14/M00/A0/80/wKgE2l0zx2SAFAFtAAK-cDo5cYQ165.jpg', 'http://b1-q.mafengwo.net/s14/M00/A0/79/wKgE2l0zx2GAa1BjAAOdkrRMeEk208.jpg', 'http://b1-q.mafengwo.net/s14/M00/A0/86/wKgE2l0zx2aAT3XcAALsGoSkppc985.jpg', 'http://p1-q.mafengwo.net/s14/M00/A0/7C/wKgE2l0zx2KAOSA8AAG3PHyIO0E377.jpg', 'http://n1-q.mafengwo.net/s14/M00/A0/81/wKgE2l0zx2SAGMlmAALff610lEg620.jpg', 'http://n1-q.mafengwo.net/s14/M00/A0/84/wKgE2l0zx2WAGOSTAAMWftGOtL4788.jpg', 'http://p1-q.mafengwo.net/s14/M00/A0/82/wKgE2l0zx2WAZgGpAANToPKJnjs053.jpg', 'http://n1-q.mafengwo.net/s14/M00/A0/7A/wKgE2l0zx2KATzrcAAMju0VrHlo157.jpg', 'http://n1-q.mafengwo.net/s14/M00/A0/7E/wKgE2l0zx2OAZyV7AAG11TJPMN0721.jpg', 'http://p1-q.mafengwo.net/s14/M00/A0/7D/wKgE2l0zx2KAJ6alAAHyF6md22I804.jpg', 'http://b1-q.mafengwo.net/s14/M00/A0/88/wKgE2l0zx2aAPxb8AAIauazvaEs577.jpg', 'http://n1-q.mafengwo.net/s14/M00/A0/83/wKgE2l0zx2WAI8iqAAF2Cwf9OsQ969.jpg']"
景德镇陶瓷的今天,http://www.mafengwo.cn/i/15755550.html,"去看看>,不再显示,出发时间/2019-07-20,出行天数/2天,人物/一个人,人均费用/100RMB,“薄如纸，莹如玉，声如磬”，好的陶瓷似美玉，怎能不让人爱不释手？今天在各大陶瓷市场逛逛，收获不小。,景德镇,的陶瓷器，到底是陶器还是瓷器，得从它的原料上说起，和当地的几个瓷器店老板深入交谈，大家能长很多见识，陶土做成的成品没上釉之前，是深褐色的，据说密度比较小，中间很多孔洞，因此陶土也比较便宜，尽管有的很多的店家在表面涂上各种各样的彩釉，看着很漂亮，实际上也只是一个陶器，看看这几张图：,瓷泥做出来的器皿才是瓷器，瓷泥又分很多种，有白泥，玉泥，“踏踏”泥之分，特点是作出的作品密度大，比较白，因此价格也比陶泥高的多，瓷器的很多精美作品如下,早就听说高岭土很有名，跑去几家店，一进门就问有没有高岭土做的瓷器，店家听完，说高岭土古代时用的多，现在很稀缺，国家一直在保护，已经禁止高岭土做陶瓷了。,除非去做批发，不然本地的陶瓷也不便宜，如果不是特别喜欢，或者没有熟人带着，还是别买，一个小壶几百块，买回去又不实用。最后提示一下朋友们，买瓷器，千万看看作品底下没有涂釉的部分，白的是瓷器，褐色的是陶器。,本篇游记共含443个文字，7张图片。帮助了名游客。,举报","['http://b1-q.mafengwo.net/s14/M00/00/7A/wKgE2l0y1RqACmNmAAgcXEPNPSM982.jpg', 'http://b1-q.mafengwo.net/s14/M00/00/90/wKgE2l0y1SGARPivAAqvDsGorQc692.jpg', 'http://p1-q.mafengwo.net/s14/M00/00/A9/wKgE2l0y1SiAYcHcAAp0SqzH1IQ965.jpg', 'http://p1-q.mafengwo.net/s14/M00/00/B7/wKgE2l0y1SyAMDcRAASplR46eqo523.jpg', 'http://p1-q.mafengwo.net/s14/M00/00/BD/wKgE2l0y1S6APTz2AALenKhBYJs117.jpg', 'http://b1-q.mafengwo.net/s14/M00/00/DB/wKgE2l0y1TqAN1e2ABDMxB8u0hU697.jpg', 'http://n1-q.mafengwo.net/s14/M00/00/E3/wKgE2l0y1T2ANUcRAAmbT2GOXHE911.jpg']"
"烟雨朦胧孕青瓷，千年瓷都景德镇,景德镇旅游攻略",http://www.mafengwo.cn/i/15749712.html,"去看看>,不再显示,本篇游记共含0个文字，7张图片。帮助了名游客。,举报","['http://n1-q.mafengwo.net/s14/M00/4C/42/wKgE2l0yjGKAOHryAAEcBGiCjIo70.jpeg', 'http://p1-q.mafengwo.net/s14/M00/4C/45/wKgE2l0yjGOAULDbAAFitK1mhMY64.jpeg', 'http://n1-q.mafengwo.net/s14/M00/4C/48/wKgE2l0yjGSAKKVsAAGGWO03xVM37.jpeg', 'http://n1-q.mafengwo.net/s14/M00/4C/3C/wKgE2l0yjF-AOorZAATxMnXVeEk74.jpeg', 'http://b1-q.mafengwo.net/s14/M00/4C/3E/wKgE2l0yjGCAQVthAAIOKD_d5Eg60.jpeg', 'http://p1-q.mafengwo.net/s14/M00/4C/41/wKgE2l0yjGGAC7QVAASSGpK2ETw07.jpeg', 'http://b1-q.mafengwo.net/s14/M00/4C/33/wKgE2l0yjFyAa6foAAJ5ORajsTg35.jpeg']"
隐于秘境，景德镇丙丁柴,http://www.mafengwo.cn/i/15725196.html,"去看看>,不再显示,出发时间/2019-07-15,出行天数/1天,人物/一个人,人均费用/100RMB,丙丁柴窑主要材料为混凝土，她坐落于一个非常安静，非常唯美的小山村，叫前程村。驱车过去的路上几次想要放弃，崎岖的村路，让我一度怀疑我是不是走错了，最后抱着勇往直前的精神，终于找到了丙丁柴，当建筑出现在我眼前的时候，建筑和自然的反差让人感觉惊艳，建筑内部为对称结构，结合光学的应用，使建筑对环境的影响降到最低，唯美的光线加混凝土构筑的结构，给人强烈的庄重感。,本篇游记共含177个文字，8张图片。帮助了名游客。,举报","['http://b1-q.mafengwo.net/s14/M00/CB/DC/wKgE2l0xpqOASV_AABBdUxMC7WA037.jpg', 'http://n1-q.mafengwo.net/s14/M00/CB/DE/wKgE2l0xpqWANVxJAAOkMpYnqTg309.jpg', 'http://n1-q.mafengwo.net/s14/M00/CB/E7/wKgE2l0xpqiAeVoMAAZK2O9hSrk873.jpg', 'http://n1-q.mafengwo.net/s14/M00/CB/EC/wKgE2l0xpqqANIkUAAqUaTrSaYw376.jpg', 'http://b1-q.mafengwo.net/s14/M00/CB/F1/wKgE2l0xpq2AF0mSAA7mCS8qsvc631.jpg', 'http://p1-q.mafengwo.net/s14/M00/CB/F4/wKgE2l0xpq6AaXUPAA6SLC-Mckc076.jpg', 'http://b1-q.mafengwo.net/s14/M00/CB/F8/wKgE2l0xpq-ARiaiAAk266_jVGI268.jpg', 'http://n1-q.mafengwo.net/s14/M00/CB/FC/wKgE2l0xprGAFRh9AAnNG34t1NU940.jpg']"
景德镇一游,http://www.mafengwo.cn/i/15661518.html,"去看看>,不再显示,出发时间/2019-07-19,出行天数/2天,人物/和朋友,人均费用/600RMB,周四决定，周五出发，对于种草已久又说走就走的,景德镇,周末游开始了，在网上找了一家评价很捧的水晶𤧞邸酒店，到达酒店真的超喜欢、店内的格局很雅致，好温馨，有种家的味道…对于喜欢逛集市、平时没事就爱买点杯碗碟的妹子来说，,景德镇,真的是超适合周末来拨草呀！,本篇游记共含122个文字，0张图片。帮助了名游客。,举报",[]
